url,content,category
https://www.nytimes.com/2007/02/18/books/chapters/0218-1st-ande.html,"‘The Triumph of the Thriller’ Advertisement Supported by First Chapter None  In 2000  Marie Arana  the editor of The Washington Post Book World  put me on the thriller beat. I had for years reviewed both fiction and nonfiction for Book World  but now Marie wanted me to focus on the crime-related novels that have come to dominate the best-seller lists. Soon I began reviewing a new book each Monday in the Post's freewheeling Style section.   Over the years  reading purely for pleasure  I'd become a fan of such writers as John D. MacDonald  Lawrence Sanders  Elmore Leonard  Ross Thomas  Ed McBain  James Lee Burke  Thomas Harris  and Michael Connelly. Now  reading thrillers on a regular basis  I learned how much more talent was out there. I discovered people like Dennis Lehane  Ian Rankin  Donna Leon  Robert Littell  George Pelecanos  John Lescroart  and Alan Furst. I reviewed best sellers by John Grisham  Tom Clancy  Sue Grafton  John Sandford  James Patterson  and Patricia Cornwell  some I admired  some I deplored  but their success says something about our popular culture. I've had the pleasure of telling our readers about new talent like Karin Slaughter  David Corbett  Robert Reuland  and Charlie Huston.   The more I read  the more I was struck by the transformation in America's reading habits. I grew up with the blockbuster novels of the 1950s and 1960s  written by people like James Michener  Harold Robbins  John O'Hara  Jacqueline Susann  Herman Wouk  and Irving Stone. They explored sex  money  movie stars  war  religion  and exotic foreign lands but rarely concerned themselves with crime. In those days  crime novels were trapped in the genre ghetto  often published as paperback originals  and rarely won a mass audience.   Today  those blockbuster novelists have been replaced on the best-seller lists by the crime-related fiction we loosely call thrillers  which includes hard-core noir  in the Hammett-Chandler private-eye tradition  as well as a bigger  broader universe of books that includes spy thrillers  legal thrillers  political thrillers  military thrillers  medical thrillers  and even literary thrillers. I have a copy of the December 25  1966  Book World-incredibly enough  I had a review in it. Starting at the top  the ten authors on the fiction best-seller list are Robert Crichton  Allen Drury  Jacqueline Susann  Rebecca West  Mary Renault  Edwin   O'Connor  James Clavell  Bernard Malamud  Harold Robbins  and Harry Mark Petrakis. Two political novelists  two or three literary writers  two grand masters of sex and schlock-but no crime fiction.   Compare that with a Book World list in February of 2006. By my count  nine of the ten books listed were thrillers  including Dan Brown's The Da Vinci Code  Sue Grafton's S Is for Silence  and John Lescroart's The Hunt Club. Another Sunday that month  The New York Times Book Review had fifteen thrillers among its sixteen hardback best sellers  including those on the Post's list plus Greg Iles's Turning Angel  and various lesser works. The transformation between the lists in 1966 and 2006 could not be more dramatic. To oversimplify a bit  John Grisham is the new James Michener and The Da Vinci Code is our Gone with the Wind.   In this book  I'll look back to the origins of modern crime fiction- to writers like Edgar Allan Poe  Arthur Conan Doyle  and Agatha Christie-to examine how the modern thriller has evolved. The triumph of the thriller  I call this transformation. We will grapple with questions of definition. Just what is a thriller? How is it different from a mystery or a crime novel? The terminology is far from precise  but let me suggest a few guidelines.   Agatha Christie and her imitators wrote mysteries that stressed intellectual solutions to crimes. Her tradition continues in so- called cozies  which appeal to readers who want no violence  and in more ingenious novels by writers like the American Martha Grimes.   In this country  around 1930  Dashiell Hammett invented the American crime novel  also known as the detective or private-eye novel  and Raymond Chandler built on Hammett's work. Their hard-boiled tradition prevailed for several decades  but by the 1970s the crime novel began to mutate into something that was bigger  darker  more imaginative  and more violent: the modern thriller. Certain novels have been milestones in expanding the boundaries of the thriller-among them Lawrence Sanders's The First Deadly Sin  Frederick Forsyth's The Day of the Jackal  Scott Turow's Presumed Innocent  Tom Clancy's The Hunt for Red October  John Grisham's The Firm  Thomas Harris's The Silence of the Lambs  and Dennis Lehane's Mystic River.   John Updike said this while reviewing Robert Littell's surreal spy novel Legends in The New Yorker in 2005: ""The slippery difference between a thriller and a non-thriller would hardly be worth groping for did not the thriller-writers themselves seem to be restive- chafing to escape  yearning for a less restrictive contract with the reader. They write longer than they used to  with more flourishes."" Updike notes that Agatha Christie's ambitions never extended past the lean  efficient mysteries she wrote  but ""Littell and le CarrÈ and the estimable P. D. James give signs of wanting to be 'real' novelists  free to follow character where it takes them and to display their knowledge of the world without the obligation to provide a thrill in every chapter.""   The estimable Updike might have gone further and added a number of other thriller writers to his list of restive souls  many of whom have gone beyond wanting to be real writers to doing it. Novels like Bangkok 8  Hard Revolution  Tropic of Night  Done for a Dime  Red Dragon  Lost Light  and The Way the Crow Flies are simply some of the best fiction being written today.   I had misgivings when Marie put me on the thriller beat. I was an English major in the uptight 1950s  when the high modernists-T. S. Eliot  James Joyce  William Faulkner-were force-fed to undergraduates  and for years I felt a tremor of guilt when I stooped to popular fiction and certainly to thrillers. A lot of people of my generation felt that way. When my political thriller The President's Mistress was published in 1976  The Washington Post's reviewer declared that she locked herself in her office until she finished it. It was  she said  ""a Mt. Everest among cliff-hangers."" I was feeling pretty good until she sandbagged me at the end: ""Of course  I always did like Chinese food.""   In other words  I'd given her a few hours of guilty pleasure  but I wasn't a serious writer providing solid sustenance. I was guilty as charged  of course  but consoled by a $250 000 paperback sale and a movie deal. A few years later I saw another review in which that same writer confessed that  after much soul-searching  she had decided it was all right to enjoy popular fiction. I was happy for her.   A lot of people have a hard time making the leap from officially approved ""literary"" fiction to novels that are fun  and they aren't all refugees from the fifties. I received an e-mail recently from a college student in Houston  an English major  asking what thrillers he should read-or whether he should read them at all. ""I am racked with guilt if I read any of this stuff. Life is short. I haven't finished all of Dickens or Shakespeare. Do I have time for detective novels?"" I could only advise him that life is a lot longer than he at present understands and there is time for  say  Elmore Leonard and Dennis Lehane along with Dickens and Shakespeare.   The more I read  the more I saw that Marie  in putting me on the thriller beat  had given me the new mainstream of American popular fiction to splash about in. I want to examine this new mainstream and how it came about. I want to show who the good writers are and why- and  to a lesser degree  who some bad ones are and why. It seems to me beyond dispute that the level of talent at work today in thrillers and crime fiction is superior to anything that has previously existed in America or Great Britain. I say this having recently reread a number of acclaimed crime novels that I first read several decades ago. Alas  the books we loved in our youth  like the sweet young things we dallied with  have not always aged well. Our memories play tricks on us and often we have been misled by movies that vastly improved the original material. Nostalgia is the sweetest of drugs  but it will cloud our minds  distort our memories  and lead us into error if we let it.   We must ask why thrillers have become increasingly popular. Of course  stories of danger and suspense have always had visceral appeal. Lee Child  author of the Jack Reacher series  once summed this up nicely:   In human evolution we developed language  we developed storytelling  and that must have been for a serious purpose. I think right from the caveman days  we had stories that involved danger and peril  and eventually safety and resolution. To me that is the story. And that's what we're still telling today  100 000 years later. That's what a page-turner is.   But there are contemporary reasons for the triumph of the thriller as well. One is the transformation of the book business. Once hailed as a ""gentleman's profession "" publishing today is more like a barroom brawl as corporate takeovers have intensified bottom-line pressures on editors. And the bottom line is that thrillers sell  which means there is a continuing scramble to find the writers who can produce books that translate into corporate profits. There are other social and cultural factors  of course. Decades of war  recession  and political and corporate corruption have made Americans more cynical- or realistic-and thus more open to novels that examine the dark side of our society. And yet most thrillers manage some sort of happy ending. They have it both ways  reminding us how ugly and dangerous our society can be and yet offering hope in the end. Thrillers provide the illusion of order and justice in a world that often seems to have none.   Of course  we read for fun too. We love the excitement of suspense. We want to know whodunit. Indeed  these days  we love suspense more than sex  at least in books. In the fifties and sixties  sex was a huge element in popular fiction  from I  the Jury to Peyton Place to Portnoy's Complaint and countless others. Today  we're up to our ears in sex. Who wants to read about it? The books I'm discussing contain relatively little sex and dirty talk  nothing like what we endure on HBO. In the modern thriller  suspense has replaced sex as the engine that drives popular fiction.   As thrillers have become more popular and their potential rewards greater  more of the most talented young writers  those who a generation ago would have produced anguished novels about their unhappy childhoods  are instead trying to become the next Grisham or Grafton. The level of their work has risen until the best of today's thrillers are the white-hot center of American fiction. We hear talk about this or that ""golden age"" of yesteryear. Forget it. Right here  right now  is the golden age of thrillers  some of which transcend genre. The Silence of the Lambs and Mystic River are excellent examples. Both novels-and the Oscar-winning movies made from them-are vastly more sophisticated and powerful than their counterparts from earlier eras.   This book is not about me-often a vital point for a writer to grasp- but it is indisputably by me  so I think it reasonable to say a little about my background  preferences  and prejudices. The central fact is that  as reader and reviewer  I fall into three related categories: bookworm  middlebrow  and writer.   The turning point in my life came when I was four and spent a year living with my maternal grandparents. My grandmother was a fussy little woman who decided it was high time I learned to read. I remember sitting on the floor as she stood at a blackboard and taught me my ABCs. Soon I was reading the Sunday comics and then books. I still have the copy of Huckleberry Finn she gave me the Christmas I was six. I was never much of a student-I was bored in the early grades and rebellious in high school-but I read a lot and could always write an essay or book report  in a pinch I would make up the book. Most of what I learned in my early years resulted from taking the bus to the Fort Worth Public Library each Saturday morning  checking out the maximum five books  reading them  and going back the next Saturday for five more. The Hardy Boys were my first crime series  if you don't count the Dick Tracy comic strip.   My mother kept best sellers around the house. The first grown-up novel I remember reading  at twelve or so  was The Robe  which featured one hell of an exciting sword fight. I loved George Orwell's Animal Farm without having a clue about its political message. I devoured the short stories of Mark Twain  who did a great deal to corrupt my young mind. When I was a teenager  you could feel awfully isolated in Texas if you weren't part of its dominant culture  which worshipped football  oil  Cadillacs  and country clubs. You were always listening for faint signals from afar  evidence that others out there shared your discontent. By high school I was deep into Somerset Maugham  whose views were decidedly un-Texan  and Sinclair Lewis  who encouraged me to scorn the George Babbitts and Elmer Gantrys I saw around me.   I spent two years at North Texas State  in nearby Denton  where my fellow students included Pat Boone  who joined my fraternity before he dashed off to stardom  and Bill Moyers  whom I would meet again a decade later in the White House. Larry McMurtry arrived on campus just after I left  we both took a writing course from Dr. James Brown. Life was good at North Texas-except that  like many an impressionable lad of that era  I had come under the spell of F. Scott Fitzgerald. I dreamed of Princeton's ivory towers. Alas  I lacked the money-not to mention the grades-to enter that distant paradise. But I had a friend at the University of the South  in Sewanee  Tennessee  and I managed to scrape together the wherewithal to enroll there.   Until then I had read at random. At Sewanee  people were actually teaching me. I took a good course on Shakespeare and a great one on the Renaissance poets  taught by an incomparable Alabaman  Dr. Charles Trawick Harrison. It was the most important course in my college career. Once you begin to appreciate the majesty of Andrew Marvell's ""But at my back I always hear / Time's wingËd chariot hurrying near"" and the music of Robert Herrick's ""Gather ye rosebuds while ye may  / Old Time is still a-flying "" you start to grasp the potential of our language. I also took a course on Romantic poets that bored me and one on literary criticism that baffled me. I was starting to realize that there were highbrows in the world and there were middlebrows  and I was among the latter. . . .  None None None Advertisement ",articles/movies
https://www.nytimes.com/2020/06/14/world/asia/sushant-singh-rajput-death.html,Sushant Singh Rajput  Bollywood Star  Dies at 34 Advertisement Supported by Mr. Rajput  who got his start on television in 2008  was “blessed with wonderful screen presence ” one critic said. The police called his death a suicide. None Sushant Singh Rajput  a prominent actor in Indian films and television programs  was found dead on Sunday in his home in Mumbai. He was 34. His family announced the death in a statement but did not give a cause. The police in Mumbai said that the death was a suicide and that an investigation was underway. “It pains us to share that Sushant Singh Rajput is no longer with us ” the family statement read. “We request his fans to keep him in their thoughts and celebrate his life and his work like they have done so far.” Mr. Rajput started his acting career on television  where he was best known for his role as a car mechanic  Manav Deshmukh  in “Pavitra Rishta ” a soap opera that debuted in 2009. None None “His rise in the world of entertainment inspired many  and he leaves behind several memorable performances ” Mr. Modi wrote. None None Sushant Singh Rajput was born on Jan. 21  1986  in Patna  in the Indian state of Bihar. His father  Krishna Kumar Singh  was an engineer  and his mother  Usha Singh  was a homemaker. Sushant was the youngest of their five children and the only boy. None He took acting and dancing classes in college  eventually dropping out to become a dancer for the choreographer Shiamak Davar. With Mr. Davar’s troupe  Mr. Rajput performed at several Bollywood events  including the 2005 Filmfare Awards and the Commonwealth Games in 2006. He later moved to Mumbai  joining a theater group for more than two years  during which he landed his first commercial. In 2008  he was spotted by a television casting agency  leading to his television debut in the drama series “Kis Desh Mein Hai Meraa Dil ” playing the stepbrother of the protagonist. His character was killed early in the series. In 2010  Mr. Rajput appeared in the fourth season of “Jhalak Dikhhla Jaa ” India’s version of “Dancing With the Stars ” with Ankita Lokhande  his “Pavitra Rishta” co-star and his girlfriend at the time. He finished in second place. Mr. Rajput’s most recent film appearance was in “Drive ” a straight-to-Netflix film produced by Dharma Productions. He is also the star of “Dil Bechara ” a film based on “The Fault in Our Stars ” the 2012 novel by John Green. The film’s scheduled release in May was postponed because of the new coronavirus pandemic. Mr. Rajput is survived by his father and four older sisters: Shweta Singh Kirti  Ritu Singh  Mitu Singh and Nitu Singh. None Advertisement ,articles/movies
https://www.nytimes.com/2008/10/02/movies/02arts-BOLLYWOODONS_BRF.html,Bollywood on Strike Advertisement Supported by Arts  Briefly None None Advertisement ,articles/movies
https://www.nytimes.com/2003/09/26/movies/film-in-review-bollywood-hollywood.html,FILM IN REVIEW  'Bollywood/Hollywood' Advertisement Supported by FILM IN REVIEW None Directed by Deepa Mehta PG-13  103 minutes The Canadian filmmaker Deepa Mehta has made a pair of striking films  ''Fire'' (1996) and ''Earth'' (1998)  about pressing social issues (sex and religion  specifically) in her native India. Now  back in Toronto  she has made ''Bollywood/Hollywood '' a disappointingly shallow and not terribly funny romantic comedy opening today in New York that seems to be making yet another bid for the public that packed its way into ''My Big Fat Greek Wedding.'' Ms. Mehta's protagonist is Rahul Seth (Rahul Khanna  who played a small role in ''Earth'')  a son of wealthy East Indian parents who has made a fortune for himself in computer technology. He has been unable to find a suitable Indian bride to take home to his mother (Moushumi Chatterjee) and grandmother (Dina Pathak  a beloved Bollywood star who died last year and who specialized in nagging mothers-in-law). With his sister's marriage coming up  he has to find a date who can pass the grueling examination process  so he hires Sue (Lisa Ray)  a beautiful but ethnically vague young woman (she lets Rahul believe she is Spanish) he has met in a bar. Believing her to be a prostitute  he pays her to take a crash course in Indian authenticity and pretend to be his fiancée at the upcoming nuptials. Dressed up in a sari  Sue turns out to be a hit with all of the female relatives  but she has a few surprises up her sleeve: she is neither Spanish nor a prostitute nor entirely uninterested in Rahul as a life partner. The script  by Ms. Mehta  wants to be self-conscious in its frequent use of cliché and coincidence  inviting comparison to both the contrived romantic comedies of Hollywood and Bollywood's grandly artificial musicals (hence the title). But the dialogue and situations have little in the way of genuine wit  and the pseudo-Bollywood production numbers that punctuate the action (often with explanatory subtitles  like ''Romantic Couple Song'') are never as extravagant or entertaining as the real thing. ''Bollywood/Hollywood'' is rated PG-13 (Parents strongly cautioned) for some strong language and mildly suggestive situations. DAVE KEHR Advertisement ,articles/movies
https://www.nytimes.com/2009/05/09/movies/09arts-STRIKECONTIN_BRF.html,Strike Continues for Bollywood Advertisement Supported by Arts  Briefly None Moviegoers in India are depending largely on Hollywood features and films from other regions as a dispute between Bollywood producers and Indian movie theater owners continues into its second month  The Associated Press reported. The standoff began in early April when Mumbai producers said they would stop making new movies if they did not receive a larger share of the profits earned from films shown at India’s multiplex theaters  which account for 60 to 65 percent of the nation’s ticket revenue. The theater owners said they would seek films they could distribute on their own. Talks between the two sides broke down on Tuesday. Advertisement ,articles/movies
https://www.nytimes.com/2017/12/14/opinion/bollywood-padmavati-ranveer-singh.html,Fear and Prejudice in Bollywood Advertisement Supported by Op-Ed Contributor None MUMBAI  India — On Dec. 1  Sanjay Leela Bhansali  one of the most opulent and operatic filmmakers in Bollywood  was releasing his movie “Padmavati ” which is based on a mythical Hindu queen. Two weeks before the theatrical release  some Hindu activists from the Rajput warrior caste declared that the movie hurt the sentiments of their community by depicting a Muslim king lusting after a Rajput queen. And they could not permit that to be shown under any circumstance. None None None None Alauddin Khilji did fight and defeat the Rajput king of Chittor in Rajasthan in the early 14th century. Queen Padmavati  however  never existed. The legend of Padmavati was born more than two centuries after Khilji’s death. Malik Muhammad Jayasi  a Sufi Muslim poet  created the character of Padmavati in an epic poem he wrote in the mid-16th century. None None The trailer of the movie suggests that Mr. Bhansali has portrayed Khilji as a savage despite historians’ rather complimentary assessments. Mr. Bhansali’s Khilji has shoulder-length hair  eyes lined with black kohl  and several scars adding menace to his face. He rides furiously ahead of a mighty invading army  pounds men to dust in wrestling matches  bares his teeth after psychopathic laughter and lustily chomps on a massive chunk of meat. None None None The protests around the movie helped create the myth of Hindu sentiments being under siege. Even a fictional queen and a Muslim king have become tools to garner Hindu votes. Fabricating a hostile “other” helps retain power. The methodology has been transparent — generate fear and hatred  and use those to legitimate violence. None Because Bollywood movies are widely publicized and occupy a significant place in everyday conversation  they become perfect targets to generate instant publicity for the groups or individuals attacking them. Bollywood has developed a justifiable sense of being left to the wolves  the state has almost never shown any inclination to prevent or curb violence against films. The film industry itself has failed to offer a unified  collective response. The biggest stars and the most influential filmmakers have stayed silent. There have been no calls for strikes and protests  no appeals for boycotts or shutdowns. They see such attacks as specific to the film  its actors and filmmaker. It doesn’t concern itself about the broader principles of creative freedom. The fear of a mob at their glamorous gates is a factor in their silence but Bollywood stars and producers also have a long history of acquiescence and cowardice in their dealings with power. The assault on Mr. Bhansali’s movie illustrates a bleak scenario where Bollywood’s anxiety about extraconstitutional censorship will weigh heavily on its creative choices. It might just fall back on the old formula of romances and comedies with song and dance routines. Advertisement ,articles/movies
https://www.nytimes.com/2014/10/03/movies/from-bollywood-with-love-.html,From Bollywood  With Love  Advertisement Supported by Movie Review None BANG BANG! Opened on Thursday Directed by Siddharth Anand In Hindi  with English subtitles 2 hours 34 minutes  not rated None None Mr. Roshan  as a superhuman James Bond manqué (He’s a former swimming champion! With 11 retreats around the world! He cooks a tasty kebab!)  does little but glower and tease. Ms. Kaif’s character — fluttery  mostly helpless and stupefied at the sight of Rajveer’s taut abs — does not advance the self-determination of women. So we are left with lavish  Imax-ready set pieces: pursuits while hydro-jet-surfing near pristine beaches  car chases on cobblestone streets  largely bloodless gunfights  and countless leaps through windows and across rooftops. It’s all high-end flash  but less romantic than wearying. Advertisement ,articles/movies
